<?xml version="1.0" encoding="UTF-8"?>

<recipe 
xmlns="https://cazzscookingcommunity.github.io" 
xmlns:xsi="http://www.w3.org/2001/XMLSchema-instance" 
xsi:schemaLocation="https://cazzscookingcommunity.github.io ../xml/recipe.xsd"> 
                                                                                
    <title>Middle Eastern Lentil Salad</title>

    <comment></comment>
    <thumbnail>../images/placeholder.png</thumbnail>
    <image></image>
    <category></category>
    <yield></yield>
    <prepTime></prepTime>
    <cookTime></cookTime>
    <part></part>


    <diet>Easy, healthy, quick and yum!</diet>
    <ingredient>FODMAP friendly</ingredient>

    <step>
Can of lentils drained and rinsed 
1/4 cup extra virgin olive oil
1 teaspoon red wine vinegar
1 teaspoon cumin
2 carrots grated 
4 fresh dates pitted and finely chopped
4 spring onions chopped 
8 cups baby spinach
1/4 cup feta in olive oil crumbled
1 cup cherry tomatoes chopped in half
SandP to taste 

Place olive oil , cumin, red wine vinegar and dates in sauce pan and heat on low until warm. Add lentils and reheat then add carrots and season with SandP. Place baby spinach and tomatoes on 4 plates then heap lentil mix on top. Sprinkle spring onions and feta on top. Serve alone or with your choice of meat. I used a pork cutlets for each person seasoned with salt and pepper.
    </step>
</recipe>