<?xml version="1.0" encoding="UTF-8"?>

<recipe 
xmlns="https://cazzscookingcommunity.github.io" 
xmlns:xsi="http://www.w3.org/2001/XMLSchema-instance" 
xsi:schemaLocation="https://cazzscookingcommunity.github.io ../xml/recipe.xsd"> 
                                                                                

    <title></title>
    <comment></comment>
    <thumbnail></thumbnail>
    <image></image>
    <diet></diet>
    <category></category>
    <yield></yield>
    <prepTime></prepTime>
    <cookTime></cookTime>
    <part></part>
    <ingredient name="" amount="" unit=""></ingredient>
    <step></step>
Gluten Free Taco Mix

2 teaspoon cumin
1 teaspoon paprika
1/2 - 1 teaspoon chilli
1 1/2 teaspoon garlic salt
1 teaspoon oregano
 1 teaspoon corn flour
1/4 teaspoon salt

<step>
    Mix all together and use for 500gms-750gms mince meat or 3 cans of beans (mixed, cannelloni and black beans.)
    Serve in tacos with your choice of extras ( cheese, avocado, lettuce, tomatoe ect.
</step>

)
</recipe>