<?xml version="1.0" encoding="UTF-8"?>

<recipe 
xmlns="https://cazzscookingcommunity.github.io" 
xmlns:xsi="http://www.w3.org/2001/XMLSchema-instance" 
xsi:schemaLocation="https://cazzscookingcommunity.github.io ../xml/recipe.xsd"> 
                                                                                

    <title></title>
    <comment></comment>
    <thumbnail></thumbnail>
    <image></image>
    <diet></diet>
    <category></category>
    <yield></yield>
    <prepTime></prepTime>
    <cookTime></cookTime>
    <part></part>
    <ingredient name="" amount="" unit=""></ingredient>
    <step></step>
Cottage Pie
FODMAP friendly

One amount of mashed spud
600 gms mince meat (lamb)
2-4 garlic cloves crushed
2 carrots grated
1/2 cup frozen peas defrosted or a zucchini grated
2 Tbsps tomatoe sauce
2 Tbsps Worcestershire sauce
1 Tbsp corn flour 
1-2 stock cubes 
Olive oil 
SandP to taste

Preheat oven to 180 degrees. Heat olive oil in large fry pan and add garlic. Once golden add mince meat and cook until brown add all other ingredients except spud. Cook until reheated and sauce thickens. Place in a tray and spoon over mash spud. Cook for 30-40 minutes or until golden brown. Serve with side salad or lots of tomatoe sauce!
</recipe>