<?xml version="1.0" encoding="UTF-8"?>

<recipe 
xmlns="https://cazzscookingcommunity.github.io" 
xmlns:xsi="http://www.w3.org/2001/XMLSchema-instance" 
xsi:schemaLocation="https://cazzscookingcommunity.github.io ../xml/recipe.xsd"> 
                                                                                

    <title></title>
    <comment></comment>
    <thumbnail></thumbnail>
    <image></image>
    <diet></diet>
    <category></category>
    <yield></yield>
    <prepTime></prepTime>
    <cookTime></cookTime>
    <part></part>
    <ingredient name="" amount="" unit=""></ingredient>
    <step></step>
Mac and Cheese Slice

1 packet macaroni 
400 gms bacon pieces cooked
1 quantity white sauce*
2 TBsp Olive oil 
Grated tasty cheese
SandP to taste

Preheat oven to 180D. Cook macaroni to packet directions and pour 2 Tbsp olive oil and stir to coat all pasta (this stops it sticking together.) Pour into baking dish with all other ingredients except cheese and stir to combine. Top with cheese and bake for 40 minutes or until lightly browned on top.

*White Sauce

125 gms butter
1/3 cup flour 
700 MPs milk
Salt and white pepper to taste

Melt butter on stove top, add flour and stir to combine. Add a little milk and stir well until it thickens. Continually do this until all milk use up. Add SandP to taste.
</recipe>