<?xml version="1.0" encoding="UTF-8"?>
<?xml-stylesheet type='text/xsl' href='/xml/xsd2html2xml/xsd2html2xml.xsl'?>

<recipe
    xmlns="https://cazzscookingcommunity.github.io"
    xmlns:xsi="http://www.w3.org/2001/XMLSchema-instance" 
    xsi:schemaLocation="https://cazzscookingcommunity.github.io ../../xml/recipe.xsd"> 
    
<title>Natural Homemade Face Scrub</title>
<filename>natural_homemade_face_scrub.xml</filename>
<thumbnail>natural_homemade_face_scrub.jpeg</thumbnail>
<category>Household</category>
<yield>1</yield>
<prepTime>PT15M</prepTime>
<cookTime>PT10M</cookTime>
<comment>c/o iamvanessae (You Tube)</comment>
<part><title>Coffee Scrub</title>
<ingredient>1/4 cup fresh coffee grounds </ingredient>
<ingredient>2 TBSP coconut oil</ingredient>
<step>Coffee scrub can be used on your body also.</step>
</part>
<part><title>Olive Oil Scrub</title>
<ingredient>3 TBSP olive oil</ingredient>
<ingredient>1/4 cup sugar</ingredient>
<step>Mix ingredients until combine and decant into repurposed jars.</step>
<step>Use once or twice a week.</step>
<step>I use mine while I'm in the shower!</step>
</part>
</recipe>

