<?xml version="1.0" encoding="UTF-8"?>
<?xml-stylesheet type='text/xsl' href='/xml/xsd2html2xml/xsd2html2xml.xsl'?>

<recipe
    xmlns="https://cazzscookingcommunity.github.io"
    xmlns:xsi="http://www.w3.org/2001/XMLSchema-instance" 
    xsi:schemaLocation="https://cazzscookingcommunity.github.io ../../xml/recipe.xsd"> 
    
<title>Coleslaw Dressing </title>
<filename>coleslaw_dressing.xml</filename>
<thumbnail>coleslaw_dressing.jpeg</thumbnail>
<category>Salad</category>
<category>Sides</category>
<diet>GlutenFree</diet>
<diet>Vegetarian</diet>
<yield>4</yield>
<prepTime>PT10M</prepTime>
<cookTime>PT10M</cookTime>
<ingredient>1/4 Mayo</ingredient>
<ingredient>1/2 lemon juiced or 1 lime juiced </ingredient>
<ingredient>1 Tbsp poppyseed </ingredient>
<ingredient>salt and pepper to taste </ingredient>
<step>Mix all ingredients together and add to your coleslaw.</step>
<step>Mix through and serve immediately.</step>
</recipe>

