<?xml version="1.0" encoding="UTF-8"?>
<?xml-stylesheet type='text/xsl' href='/xml/xsd2html2xml/xsd2html2xml.xsl'?>

<recipe 
xmlns="https://cazzscookingcommunity.github.io" 
xmlns:xsi="http://www.w3.org/2001/XMLSchema-instance" 
xsi:schemaLocation="https://cazzscookingcommunity.github.io recipe.xsd"> 
                                                                                
    <title>Natural Homemade Face Scrub</title>
    <filename>natural_homemade_face_scrub.xml</filename>

    <comment>c/o iamvanessae (You Tube)</comment>
    <thumbnail>../images/placeholder.png</thumbnail>
    <image></image>
    <category>Personal</category>
    <yield></yield>
    <prepTime></prepTime>
    <cookTime></cookTime>

    <part>
        <title>Coffee Scrub</title>
        <ingredient>1/4 cup fresh coffee grounds </ingredient>
        <ingredient>2 TBSP coconut oil</ingredient>
        <step></step>
    </part>

    <part>
        <title>Olive Oil Scrub</title>
        <ingredient>3 TBSP olive oil</ingredient>
        <ingredient>1/4 cup sugar</ingredient>
        <step>
            Mix ingredients until combine and decant into repurposed jars. Use once or twice a week. (I use mine while Im in the shower!)
            Coffee Scrub can be used on your body also.
        </step>
    </part>


</recipe>