<?xml version="1.0" encoding="UTF-8"?>

<recipe 
xmlns="https://cazzscookingcommunity.github.io" 
xmlns:xsi="http://www.w3.org/2001/XMLSchema-instance" 
xsi:schemaLocation="https://cazzscookingcommunity.github.io ../xml/recipe.xsd"> 
                                                                                

    <title></title>
    <comment></comment>
    <thumbnail></thumbnail>
    <image></image>
    <diet></diet>
    <category></category>
    <yield></yield>
    <prepTime></prepTime>
    <cookTime></cookTime>
    <part></part>
    <ingredient name="" amount="" unit=""></ingredient>
    <step></step>
CHOWDER
Gluten Free

1 can creamed corn 
4 potatoes peeled and chopped
2 large carrots chopped
200-300gms diced bacon
2 chicken stock cubes
Milk and Water
Oil
SandP to taste

Heat oil in large pot and cook the bacon until brown.  Add can of creamed corn then fill can with milk and pour into pot then do the same with water. Add all other ingredients and bring to simmer. Cook until veggies are soft, stir every now and then, to stop bottom catching (about 30-45 mins) Serve with thick toast or fresh bread if desired. You can double recipe.  Great for a cold winter lunch!
</recipe>